{"schema_version":"2.0","packet_id":"UPD-20260905-GATE3-CORRECTIONS","known_at":"2026-09-05T00:34:00-04:00","evidence_cutoff":"2026-09-05T00:34:00-04:00","summary":"Retrospective Gate 3 corrections with separate event and public-availability clocks.","sources":[{"source_id":"SRC-8AA72E95F42A","outlet":"Associated Press","title":"New US missile appears to have left wide path of death and destruction in Iranian city, report says","url":"https://apnews.com/article/b4a37c59bcf5d1a11eb87aa79f153648","published_date":"2026-08-31","source_role":"INDEPENDENT_WIRE"},{"source_id":"SRC-3779F2E06006","outlet":"Airwars","title":"New U.S. munition has damage radius of at least 170 metres, Airwars finds","url":"https://airwars.org/prsm-lamerd-iran","published_date":"2026-08-31","source_role":"TECHNICAL_OSINT"},{"source_id":"SRC-4D526A94AA28","outlet":"Reuters","title":"Iranian-made drone hits British air base in Cyprus","url":"https://www.reuters.com/world/europe/british-air-base-cyprus-hit-by-suspected-drone-strike-sky-news-reports-2026-03-02/","published_date":"2026-03-02","source_role":"INDEPENDENT_WIRE"},{"source_id":"SRC-3EEE43EFD239","outlet":"UK Prime Minister's Office","title":"Prime Minister's Oral Statement on Iran: 2 March 2026","url":"https://www.gov.uk/government/speeches/prime-ministers-oral-statement-on-iran-2-march-2026","published_date":"2026-03-02","source_role":"PRIMARY_OFFICIAL"},{"source_id":"SRC-80807759E91F","outlet":"UK Parliament","title":"Written answer: RAF Akrotiri drone launch location","url":"https://questions-statements.parliament.uk/written-questions/detail/2026-03-03/117492","published_date":"2026-03-30","source_role":"PRIMARY_OFFICIAL"},{"source_id":"SRC-D83151F6507C","outlet":"Associated Press","title":"As the Pentagon stays quiet, AP reconstructs a US strike that killed over 100 Iranian children","url":"https://apnews.com/article/2a134a5c74d80db763db4c3eb6d0d847","published_date":"2026-07-02","source_role":"INDEPENDENT_WIRE"},{"source_id":"SRC-515A62FE0AF7","outlet":"Reuters","title":"Interim U.S.-Iran agreement / shipping resumption video report","url":"https://www.reuters.com/video/watch/idRW021518062026RP1/","published_date":"2026-06-18","source_role":"INDEPENDENT_WIRE"}],"events":[{"event_id":"G3-AKROTIRI-20260302","event_date":"2026-03-02","event_time":"00:00 local approx.","event_time_precision":"APPROXIMATE","summary":"A one-way attack drone struck RAF Akrotiri in Cyprus, causing limited damage and no casualties. The UK later said the drone was not launched from Iran and assessed Lebanon or Iraq as the likely origin.","event_type":"DRONE_STRIKE","event_class":"CORE_WARTIME_EVENT","evidence_form":"MULTISOURCE_REPORTED","knowledge_class":"RETROSPECTIVE_CORRECTION","strike_countable":true,"public_available_time":"2026-03-02T00:00:00+02:00","game_knowledge_time":"2026-09-05T00:35:00-04:00","source_ids":["SRC-4D526A94AA28","SRC-3EEE43EFD239","SRC-80807759E91F"],"adjudication_note":"Supersedes the bad Mar. 1 missile formulation. Iranian-designed Shahed type does not establish launch from Iran; later UK assessment placed likely launch origin in Lebanon or Iraq."},{"event_id":"G3-MINAB-SCHOOL-20260228","event_date":"2026-02-28","event_time_precision":"DATE_ONLY","summary":"A U.S. missile struck the Shajareh Tayyebeh school compound in Minab, killing a large number of civilians, most of them children. U.S. culpability is strongly supported; deliberate civilian targeting is not established.","event_type":"CIVILIAN_CASUALTY_STRIKE","event_class":"CORE_WARTIME_EVENT","evidence_form":"INDEPENDENT_RECONSTRUCTION","knowledge_class":"RETROSPECTIVE_DISCOVERY","strike_countable":true,"public_available_time":"2026-07-02T00:00:00-04:00","game_knowledge_time":"2026-09-05T00:35:00-04:00","source_ids":["SRC-D83151F6507C"],"adjudication_note":"Occurrence and U.S. culpability are strongly indicated by AP reconstruction and U.S. official knowledge. Intent remains unresolved; do not infer deliberate targeting from civilian deaths."},{"event_id":"G3-LAMERD-20260228","event_date":"2026-02-28","event_time_precision":"DATE_ONLY","summary":"Retrospective AP/Airwars analysis linked wide-area civilian harm in Lamerd to apparent PrSM effects; at least 21 civilians, including seven children, were reported killed. CENTCOM denied striking Lamerd.","event_type":"RETROSPECTIVE_CIVILIAN_CASUALTY_STRIKE","event_class":"CORE_WARTIME_EVENT","evidence_form":"TECHNICAL_OSINT_CONTESTED_ATTRIBUTION","knowledge_class":"RETROSPECTIVE_DISCOVERY","strike_countable":true,"public_available_time":"2026-08-31T00:00:00-04:00","game_knowledge_time":"2026-09-05T00:35:00-04:00","source_ids":["SRC-8AA72E95F42A","SRC-3779F2E06006"],"adjudication_note":"Historical event date is preserved separately from Aug. 31 public availability. Technical attribution is strong but contested by CENTCOM denial."},{"event_id":"G3-MOU-IMPLEMENTATION-20260618","event_date":"2026-06-18","event_time_precision":"DATE_ONLY","summary":"Implementation of the June U.S.-Iran interim arrangement began and commercial vessels resumed transit through the Strait of Hormuz.","event_type":"AGREEMENT_IMPLEMENTATION","event_class":"DIPLOMATIC_OR_POLICY_EVENT","evidence_form":"MULTISOURCE_REPORTED","knowledge_class":"CONTEMPORANEOUS","strike_countable":false,"public_available_time":"2026-06-18T00:00:00-04:00","game_knowledge_time":"2026-06-18T00:00:00-04:00","source_ids":["SRC-515A62FE0AF7"],"adjudication_note":"REV-007 requires June 15, June 17 and June 18 to remain distinct. This is implementation, not signing."}],"entities":[],"narrative_claims":[]}
