{
  "schema_version": "2.0",
  "status": "ACCEPTED",
  "packet_id": "UPD-20260929-0000ET-CATCHUP",
  "known_at": "2026-09-29T16:28:30-04:00",
  "evidence_cutoff": "2026-09-29T00:00:00-04:00",
  "upstream_provenance": {
    "locker_artifacts": [
      "data/evidence-integration/rook-evidence-locker-sweep-20260929T0000ET.json"
    ],
    "collection_basis": "Recovered Sep.28 13:15-24:00 ET horizon plus explicitly time-preserved late discovery of material Sep.28 shipping/contact evidence.",
    "claim_domain_handoff": "data/evidence-integration/atlas-downstream-review-routing-20260929.json",
    "web_of_lies": "NO_DIRECT_WOL_MUTATION; CLAIM_REVIEW_ROUTED"
  },
  "summary": "Advances Atlas through midnight Sep.29 ET. It records that U.S. and Iranian officials actually spoke separately with mediators on Sep.28, preserves Trump's later public denial that he offered sanctions or frozen-fund relief, and adds public Kpler/LSEG evidence that crude and Qatar-linked LNG traffic through Hormuz had materially recovered without returning to pre-war normalization.",
  "sources": [
    {
      "source_id": "SRC-13A4316EB312",
      "url": "https://www.reuters.com/world/trump-denies-offering-iran-sanctions-relief-nuclear-concessions-2026-09-29/",
      "source_role": "REUTERS_US_PUBLIC_DENIAL_AND_COMPETING_ANONYMOUS_OFFICIAL_REPORTING"
    },
    {
      "source_id": "SRC-F90D12D70600",
      "url": "https://www.reuters.com/business/energy/mideast-oil-exports-rebound-september-saudi-arabia-boosts-shipments-2026-09-28/",
      "source_role": "REUTERS_KPLER_MIDDLE_EAST_CRUDE_EXPORT_RECOVERY"
    },
    {
      "source_id": "SRC-D4508CB7D6AB",
      "url": "https://www.reuters.com/business/energy/qatar-linked-lng-traffic-through-hormuz-strait-picks-up-despite-conflict-2026-09-28/",
      "source_role": "REUTERS_KPLER_LSEG_QATAR_LNG_HORMUZ_TRANSITS"
    }
  ],
  "events": [
    {
      "event_id": "G3-US-IRAN-MEDIATOR-CONTACTS-OCCURRED-20260928",
      "event_date": "2026-09-28",
      "event_class": "DIPLOMATIC_OR_POLICY_EVENT",
      "event_type": "US_IRAN_SEPARATE_MEDIATOR_CONTACTS_OCCURRED",
      "public_available_time": "2026-09-28T09:39:00-04:00",
      "game_knowledge_time": "2026-09-29T16:28:30-04:00",
      "evidence_horizon_time": "2026-09-29T00:00:00-04:00",
      "strike_countable": false,
      "summary": "Reuters reported that U.S. and Iranian officials spoke separately with mediators on Sep.28. This advances the prior prospective record from talks expected to talks occurring, while preserving that the format was mediated and no agreement was reached.",
      "source_ids": [
        "SRC-03EF3E9F6CD4"
      ]
    },
    {
      "event_id": "G3-TRUMP-DENIES-SANCTIONS-FUNDS-OFFER-20260928",
      "event_date": "2026-09-28",
      "event_class": "DIPLOMATIC_OR_POLICY_EVENT",
      "event_type": "US_PUBLIC_DENIAL_OF_REPORTED_IRAN_RELIEF_OFFER",
      "public_available_time": "2026-09-28T23:15:00-04:00",
      "game_knowledge_time": "2026-09-29T16:28:30-04:00",
      "evidence_horizon_time": "2026-09-29T00:00:00-04:00",
      "strike_countable": false,
      "summary": "Trump publicly denied reports that he had offered Iran sanctions relief or release of frozen funds for nuclear concessions. Reuters preserved his denial alongside earlier reports citing unidentified U.S. officials; Atlas does not resolve that source conflict in this evidence packet.",
      "source_ids": [
        "SRC-13A4316EB312"
      ]
    },
    {
      "event_id": "G3-HORMUZ-OIL-EXPORT-RECOVERY-20260928",
      "event_date": "2026-09-28",
      "event_class": "STATE_SNAPSHOT",
      "event_type": "HORMUZ_AND_MIDEAST_CRUDE_EXPORT_RECOVERY_SNAPSHOT",
      "public_available_time": "2026-09-27T20:17:00-04:00",
      "game_knowledge_time": "2026-09-29T16:28:30-04:00",
      "evidence_horizon_time": "2026-09-29T00:00:00-04:00",
      "strike_countable": false,
      "summary": "Reuters reported Kpler estimates placing September Middle East crude exports at 16.328 million bpd, the highest since the war began but about 3.2 million bpd below February. Hormuz-linked exports were estimated near 9.719 million bpd and 19 Saudi VLCCs exited the strait in the prior week. AIS-dark traffic remained outside visible counts.",
      "source_ids": [
        "SRC-F90D12D70600"
      ]
    },
    {
      "event_id": "G3-QATAR-LNG-HORMUZ-VISIBLE-TRANSITS-20260928",
      "event_date": "2026-09-28",
      "event_class": "STATE_SNAPSHOT",
      "event_type": "QATAR_LINKED_LNG_VISIBLE_HORMUZ_TRANSIT_RECOVERY",
      "public_available_time": "2026-09-28T05:30:00-04:00",
      "game_knowledge_time": "2026-09-29T16:28:30-04:00",
      "evidence_horizon_time": "2026-09-29T00:00:00-04:00",
      "strike_countable": false,
      "summary": "Reuters reported that visible Qatar-linked LNG traffic through Hormuz had increased in September after no visible transits in August. The report explicitly retained the possibility of AIS-dark crossings and did not establish full normalization.",
      "source_ids": [
        "SRC-D4508CB7D6AB"
      ]
    }
  ],
  "entities": [
    {
      "entity_type": "diplomacy",
      "entity_id": "DIP-US-IRAN-UNGA-CONTACTS-20260922",
      "mode": "update",
      "record": {
        "status": "MEDIATED_ENGAGEMENT_CONFIRMED; INDIRECT_FORMAT_SUPPORTED_BY_LATEST_REUTERS_RECONSTRUCTION; COMPETING_PUBLIC_CHARACTERIZATION_PRESERVED; PARTIES_REPORTED_FAR_APART_AS_OF_SEP24; DIPLOMACY_CONTINUED; PHASED_HORMUZ_BLOCKADE_FRAMEWORK_REPORTED; IRAN_SEVEN_DAY_PROPOSAL_PUBLICLY_STATED; WSJ_REPORTED_US_REJECTION_PRESERVED; DIRECT_TRUMP_REJECTION_CONFIRMED_SEP26; POST_REJECTION_REGIONAL_POSITIONING_ACTIVE; SAUDI_PREWAR_NO_FEE_BASELINE_STATED; OMAN_MEDIATION_CONTINUES; RUSSIA_OFFERS_GULF_SECURITY_ARCHITECTURE_SUPPORT; IRAN_POST_REJECTION_HORMUZ_CONDITIONS_REAFFIRMED_SEP27; IRAN_OPEN_TO_NUCLEAR_AND_OTHER_TALKS_SEP27; QATAR_MEDIATION_CONTINUES_AFTER_REJECTION; AMENDED_SEVEN_DAY_PROPOSAL_IN_SHUTTLE_DISCUSSION_SEP28; MEDIATOR_CONTACTS_OCCURRED_SEP28; TRUMP_DENIES_SANCTIONS_FUNDS_OFFER_SEP28; NO_AGREEMENT; NO_ACCEPTED_SETTLEMENT; NO_COMMON_REGIONAL_FRAMEWORK_ESTABLISHED",
        "observed_state": "After the U.S. president rejected Iran's original seven-day proposal, the mediated channel remained active. By Sep.28, U.S. and Iranian officials had separately spoken with mediators rather than merely planning to do so. Later that night Trump publicly denied reports that he had offered sanctions relief or frozen-fund release for nuclear steps. The denial and anonymous-official reporting remain competing evidence. No replacement agreement or accepted settlement is established.",
        "knowledge_time": "2026-09-29T16:28:30-04:00",
        "source_ids": [
          "SRC-F998CB101972",
          "SRC-147F3EB0E6BC",
          "SRC-25BB1B596B72",
          "SRC-6D4B41984CFD",
          "SRC-3C3CB8B494AA",
          "SRC-B63B1CFF1B21",
          "SRC-F98CA0A64F09",
          "SRC-BE3466904600",
          "SRC-E48C2BF4BA86",
          "SRC-5EB57BE7099F",
          "SRC-49ED905D994D",
          "SRC-18A822A93DFC",
          "SRC-C7A82D89ACEA",
          "SRC-F917DE0C3BC3",
          "SRC-A5BA6AAB7890",
          "SRC-0042073EBED2",
          "SRC-03EF3E9F6CD4",
          "SRC-5572ACB81217",
          "SRC-13A4316EB312"
        ]
      }
    }
  ],
  "narrative_claims": []
}
