{"schema_version":"2.0","packet_id":"UPD-20260905-GATE3-CURRENT-A","known_at":"2026-09-05T00:36:00-04:00","evidence_cutoff":"2026-09-05T00:36:00-04:00","summary":"Gate 3 Aug. 28-Sep. 1 evidence increment: sanctions enforcement, renewed direct kinetics, Mecca institutionalization and tanker attacks.","sources":[{"source_id":"SRC-2AEED904869F","outlet":"U.S. Department of the Treasury","title":"Treasury Launches Unprecedented Campaign Against Iranian Regime on Economic D-Day","url":"https://home.treasury.gov/news/press-releases/sb0613","published_date":"2026-08-24","source_role":"PRIMARY_OFFICIAL"},{"source_id":"SRC-ED6D18BED499","outlet":"U.S. Department of the Treasury","title":"Iran’s Access to UAE Banks Targeted Under Operation Economic Outcast","url":"https://home.treasury.gov/news/press-releases/sb0617/","published_date":"2026-08-28","source_role":"PRIMARY_OFFICIAL"},{"source_id":"SRC-B17563B6066A","outlet":"Reuters","title":"Explosion heard near Iran's Larak Island; U.S. official says two launchers struck","url":"https://www.reuters.com/world/middle-east/explosion-heard-near-irans-larak-island-fars-news-agency-reports-2026-08-30/","published_date":"2026-08-30","source_role":"INDEPENDENT_WIRE"},{"source_id":"SRC-F854324F240D","outlet":"Reuters","title":"Iran's IRGC says it launched attack on two U.S. bases in Jordan","url":"https://www.reuters.com/world/middle-east/irans-irgc-says-it-launched-attack-two-us-bases-jordan-2026-08-30/","published_date":"2026-08-30","source_role":"INDEPENDENT_WIRE"},{"source_id":"SRC-A37E157FFC6D","outlet":"Reuters","title":"Turkey, Saudi Arabia, Pakistan hold first defence pact meeting","url":"https://www.reuters.com/world/asia-pacific/turkey-saudi-arabia-pakistan-hold-first-defence-pact-meeting-source-says-2026-08-30/","published_date":"2026-08-30","source_role":"INDEPENDENT_WIRE"},{"source_id":"SRC-48687953ECA1","outlet":"Reuters","title":"Saudi Arabia, Turkey, Pakistan agree to establish secretariat under joint defence pact","url":"https://www.reuters.com/world/middle-east/saudi-arabia-turkey-pakistan-agree-establish-secretariat-under-joint-defence-2026-08-31/","published_date":"2026-08-31","source_role":"INDEPENDENT_WIRE"},{"source_id":"SRC-3DCF869A30A3","outlet":"U.S. Central Command","title":"CENTCOM Completes Strikes on IRGC Targets in Iran","url":"https://www.centcom.mil/MEDIA/PUBLIC-RELEASES/Article/4588389/centcom-completes-strikes-on-irgc-targets-in-iran/","published_date":"2026-09-01","source_role":"PRIMARY_OFFICIAL"},{"source_id":"SRC-C95FE4CFA0BF","outlet":"Reuters","title":"Two tankers carrying Saudi oil attacked in Strait of Hormuz","url":"https://www.reuters.com/business/energy/two-tankers-carrying-saudi-oil-attacked-strait-hormuz-2026-09-01/","published_date":"2026-09-01","source_role":"INDEPENDENT_WIRE"}],"events":[{"event_id":"G3-ECON-OUTCAST-UAE-20260828","event_date":"2026-08-28","event_time_precision":"DATE_ONLY","summary":"Treasury escalated Operation Economic Outcast by proposing to revoke Banque Misr UAE's U.S. correspondent access and sanctioning additional Iran-linked financial actors.","event_type":"SANCTIONS_ENFORCEMENT","event_class":"DIPLOMATIC_OR_POLICY_EVENT","evidence_form":"PRIMARY_OFFICIAL","knowledge_class":"CONTEMPORANEOUS","strike_countable":false,"public_available_time":"2026-08-28T00:00:00-04:00","game_knowledge_time":"2026-08-28T00:00:00-04:00","source_ids":["SRC-ED6D18BED499"],"adjudication_note":"Establishes initial implementation/enforcement. Treasury assertions about the scale of Iranian wrongdoing remain actor claims unless independently corroborated."},{"event_id":"G3-LARAK-US-STRIKE-20260830","event_date":"2026-08-30","event_time_precision":"DATE_ONLY","summary":"The United States struck two Iranian launchers on Larak Island after reporting preparations connected to rockets and sea-mining activity; Iran subsequently claimed retaliation against U.S. bases in Jordan.","event_type":"DIRECT_US_IRAN_KINETIC_RENEWAL","event_class":"CORE_WARTIME_EVENT","evidence_form":"MULTISOURCE_REPORTED","knowledge_class":"CONTEMPORANEOUS","strike_countable":true,"public_available_time":"2026-08-30T00:00:00-04:00","game_knowledge_time":"2026-08-30T00:00:00-04:00","source_ids":["SRC-B17563B6066A","SRC-F854324F240D"],"adjudication_note":"Ends the late-July direct-strike lull. Iranian retaliation claims must be separated from independently established impacts."},{"event_id":"G3-MECCA-SECRETARIAT-20260831","event_date":"2026-08-31","event_time_precision":"DATE_ONLY","summary":"Saudi Arabia, Türkiye and Pakistan moved the Mecca defense pact into institution-building by establishing a Saudi-based secretariat after the first committee meeting.","event_type":"ALLIANCE_INSTITUTION_BUILDING","event_class":"DIPLOMATIC_OR_POLICY_EVENT","evidence_form":"MULTISOURCE_REPORTED","knowledge_class":"CONTEMPORANEOUS","strike_countable":false,"public_available_time":"2026-08-31T00:00:00-04:00","game_knowledge_time":"2026-08-31T00:00:00-04:00","source_ids":["SRC-A37E157FFC6D","SRC-48687953ECA1"],"adjudication_note":"Upgrades current state from a signed pact to institution-building; does not establish displacement of existing U.S.-Saudi defense ties."},{"event_id":"G3-CENTCOM-IRGC-WAVE-20260901","event_date":"2026-09-01","event_time_precision":"DATE_ONLY","summary":"CENTCOM completed a wave of strikes on IRGC air-defense sites, radar systems, maritime assets/facilities, mine-laying capabilities and communications sites.","event_type":"US_STRIKE_WAVE","event_class":"CORE_WARTIME_EVENT","evidence_form":"PRIMARY_OFFICIAL","knowledge_class":"CONTEMPORANEOUS","strike_countable":true,"public_available_time":"2026-09-01T00:00:00-04:00","game_knowledge_time":"2026-09-01T00:00:00-04:00","source_ids":["SRC-3DCF869A30A3"],"adjudication_note":"Target categories are confirmed as U.S. action; claimed success/effect is not converted into independently verified BDA."},{"event_id":"G3-HORMUZ-TANKERS-20260901","event_date":"2026-09-01","event_time_precision":"DATE_ONLY","summary":"VLCCs Sidr and Senegal Prosperity, carrying Saudi oil, were struck by unknown projectiles near Khasab/Oman minutes apart; crews were reported safe.","event_type":"COMMERCIAL_SHIPPING_ATTACK","event_class":"CORE_WARTIME_EVENT","evidence_form":"INDEPENDENT_WIRE","knowledge_class":"CONTEMPORANEOUS","strike_countable":true,"public_available_time":"2026-09-01T00:00:00-04:00","game_knowledge_time":"2026-09-01T00:00:00-04:00","source_ids":["SRC-C95FE4CFA0BF"],"adjudication_note":"Attribution remains unknown; do not assign Iran absent additional evidence."}],"entities":[],"narrative_claims":[]}
