{
  "schema_version": "2.0",
  "status": "ACCEPTED",
  "packet_id": "UPD-20260929-1200ET-CATCHUP",
  "known_at": "2026-09-29T16:28:31-04:00",
  "evidence_cutoff": "2026-09-29T12:00:00-04:00",
  "upstream_provenance": {
    "locker_artifacts": [
      "data/evidence-integration/rook-evidence-locker-sweep-20260929T1200ET.json"
    ],
    "collection_basis": "Recovered Sep.29 00:00-12:00 ET horizon; later Sep.29 developments excluded.",
    "claim_domain_handoff": "data/evidence-integration/atlas-downstream-review-routing-20260929.json",
    "web_of_lies": "IRGC_CLAIMS_AND_ETHAN_LEVINS_NEW_SOURCE_EVIDENCE_ROUTED_FOR_SPECIALIST_REVIEW; NO_COUNTS_MUTATED"
  },
  "summary": "Advances Atlas through noon Sep.29 ET. It records Iran's description of new Qatar-mediated ideas for meeting its Hormuz conditions, the IRGC's direct appeal to U.S. voters and associated claim-review needs, resumed Saudi Yanbu loadings, the final U.S. force-withdrawal schedule from Iraq, and a Reuters snapshot of severe household economic strain inside Iran. No U.S.-Iran agreement or U.S. acceptance of Iran's conditions is inferred.",
  "sources": [
    {
      "source_id": "SRC-B52CFBB65D5A",
      "url": "https://ca.marketscreener.com/news/iran-says-qatar-will-convey-new-proposals-to-us-in-bid-to-end-war-ce785addda8cf626",
      "source_role": "REUTERS_VIDEO_SYNDICATION_OF_ARAQCHI_MEDIATOR_IDEAS_STATEMENT"
    },
    {
      "source_id": "SRC-8C8DCF0C3D2F",
      "url": "https://www.reuters.com/world/middle-east/irans-revolutionary-guards-call-trump-big-liar-2026-09-29/",
      "source_role": "REUTERS_IRGC_US_VOTER_OPEN_LETTER_AND_HORMUZ_CLAIMS"
    },
    {
      "source_id": "SRC-FACE10D63941",
      "url": "https://www.reuters.com/business/energy/saudi-resumes-yanbu-oil-loading-after-pipeline-restart-2026-09-29/",
      "source_role": "REUTERS_SAUDI_YANBU_PIPELINE_AND_LOADING_RECOVERY"
    },
    {
      "source_id": "SRC-F8CB8025934E",
      "url": "https://www.reuters.com/world/middle-east/us-forces-exit-iraq-after-two-decades-leaving-opening-iran-2026-09-29/",
      "source_role": "REUTERS_US_IRAQ_WITHDRAWAL_ENDSTATE_AND_REACTIONS"
    },
    {
      "source_id": "SRC-9A4A11CAA608",
      "url": "https://www.reuters.com/business/energy/iranians-stagger-under-soaring-costs-seven-months-war-2026-09-29/",
      "source_role": "REUTERS_IRAN_WARTIME_HOUSEHOLD_ECONOMIC_STRESS"
    }
  ],
  "events": [
    {
      "event_id": "G3-IRAN-QATAR-NEW-IDEAS-HORMUZ-20260929",
      "event_date": "2026-09-28",
      "event_class": "DIPLOMATIC_OR_POLICY_EVENT",
      "event_type": "IRAN_QATAR_MEDIATION_NEW_IDEAS_FOR_HORMUZ_CONDITIONS",
      "public_available_time": "2026-09-29T04:52:00-04:00",
      "game_knowledge_time": "2026-09-29T16:28:31-04:00",
      "evidence_horizon_time": "2026-09-29T12:00:00-04:00",
      "strike_countable": false,
      "summary": "Araqchi said Qatari mediators had discussed ideas with Iran on how Iran's Hormuz conditions could be fulfilled and would present those ideas to the U.S. side. This establishes a more specific mediation step, not U.S. acceptance of Iran's conditions or an agreement.",
      "source_ids": [
        "SRC-B52CFBB65D5A"
      ]
    },
    {
      "event_id": "G3-IRGC-US-VOTER-OPEN-LETTER-20260929",
      "event_date": "2026-09-29",
      "event_class": "DIPLOMATIC_OR_POLICY_EVENT",
      "event_type": "IRGC_DIRECT_US_VOTER_INFORMATION_CAMPAIGN",
      "public_available_time": "2026-09-29T05:30:00-04:00",
      "game_knowledge_time": "2026-09-29T16:28:31-04:00",
      "evidence_horizon_time": "2026-09-29T12:00:00-04:00",
      "strike_countable": false,
      "summary": "The IRGC issued a 25-page open letter aimed at U.S. voters urging rejection of Trump's policies and offering peaceful coexistence if U.S. policy changed. Its factual assertions about Iran's nuclear aims and Hormuz effectiveness are preserved as attributed claims pending Claims Forensics review.",
      "source_ids": [
        "SRC-8C8DCF0C3D2F"
      ]
    },
    {
      "event_id": "G3-SAUDI-YANBU-LOADINGS-RESUME-20260929",
      "event_date": "2026-09-29",
      "event_class": "STATE_SNAPSHOT",
      "event_type": "SAUDI_RED_SEA_EXPORT_LOADINGS_RESUME",
      "public_available_time": "2026-09-29T02:35:00-04:00",
      "game_knowledge_time": "2026-09-29T16:28:31-04:00",
      "evidence_horizon_time": "2026-09-29T12:00:00-04:00",
      "strike_countable": false,
      "summary": "Reuters reported that Saudi Arabia resumed crude and refined-product tanker loadings from Yanbu after restarting the East-West Pipeline. Public estimates placed current throughput below the pre-attack rate but rising, adding another functioning export path outside Hormuz.",
      "source_ids": [
        "SRC-FACE10D63941"
      ]
    },
    {
      "event_id": "G3-US-IRAQ-WITHDRAWAL-ENDSTATE-20260929",
      "event_date": "2026-09-29",
      "event_class": "STATE_SNAPSHOT",
      "event_type": "US_FORCE_WITHDRAWAL_FROM_LAST_IRAQ_BASES",
      "public_available_time": "2026-09-29T02:05:00-04:00",
      "game_knowledge_time": "2026-09-29T16:28:31-04:00",
      "evidence_horizon_time": "2026-09-29T12:00:00-04:00",
      "strike_countable": false,
      "summary": "Reuters reported U.S. forces were set to leave their last Iraq bases by Sep.30 under the withdrawal arrangement agreed in 2024. Iran-aligned Iraqi groups publicly celebrated the departure; concerns about the resulting security environment remain attributed to quoted Iraqi and Kurdish sources.",
      "source_ids": [
        "SRC-F8CB8025934E"
      ]
    },
    {
      "event_id": "G3-IRAN-HOUSEHOLD-ECONOMIC-STRESS-20260929",
      "event_date": "2026-09-29",
      "event_class": "STATE_SNAPSHOT",
      "event_type": "IRAN_WARTIME_HOUSEHOLD_ECONOMIC_STRESS_SNAPSHOT",
      "public_available_time": "2026-09-29T06:15:00-04:00",
      "game_knowledge_time": "2026-09-29T16:28:31-04:00",
      "evidence_horizon_time": "2026-09-29T12:00:00-04:00",
      "strike_countable": false,
      "summary": "Reuters documented severe household-level economic strain inside Iran, including high living costs, rent pressure, medicine affordability problems and private-sector job losses. Reuters sources linked the latest diplomatic burst partly to economic strain; Atlas preserves that causal statement as attributed reporting rather than an exclusive explanation.",
      "source_ids": [
        "SRC-9A4A11CAA608"
      ]
    }
  ],
  "entities": [
    {
      "entity_type": "diplomacy",
      "entity_id": "DIP-US-IRAN-UNGA-CONTACTS-20260922",
      "mode": "update",
      "record": {
        "status": "MEDIATED_ENGAGEMENT_CONFIRMED; INDIRECT_FORMAT_SUPPORTED_BY_LATEST_REUTERS_RECONSTRUCTION; COMPETING_PUBLIC_CHARACTERIZATION_PRESERVED; PARTIES_REPORTED_FAR_APART_AS_OF_SEP24; DIPLOMACY_CONTINUED; PHASED_HORMUZ_BLOCKADE_FRAMEWORK_REPORTED; IRAN_SEVEN_DAY_PROPOSAL_PUBLICLY_STATED; WSJ_REPORTED_US_REJECTION_PRESERVED; DIRECT_TRUMP_REJECTION_CONFIRMED_SEP26; POST_REJECTION_REGIONAL_POSITIONING_ACTIVE; SAUDI_PREWAR_NO_FEE_BASELINE_STATED; OMAN_MEDIATION_CONTINUES; RUSSIA_OFFERS_GULF_SECURITY_ARCHITECTURE_SUPPORT; IRAN_POST_REJECTION_HORMUZ_CONDITIONS_REAFFIRMED_SEP27; IRAN_OPEN_TO_NUCLEAR_AND_OTHER_TALKS_SEP27; QATAR_MEDIATION_CONTINUES_AFTER_REJECTION; AMENDED_SEVEN_DAY_PROPOSAL_IN_SHUTTLE_DISCUSSION_SEP28; MEDIATOR_CONTACTS_OCCURRED_SEP28; TRUMP_DENIES_SANCTIONS_FUNDS_OFFER_SEP28; QATAR_MEDIATORS_CARRY_IDEAS_FOR_IRAN_CONDITIONS_SEP29; US_ACCEPTANCE_OF_IRAN_CONDITIONS_NOT_ESTABLISHED; NO_AGREEMENT; NO_ACCEPTED_SETTLEMENT; NO_COMMON_REGIONAL_FRAMEWORK_ESTABLISHED",
        "observed_state": "The mediated channel remained active after Trump's rejection of Iran's original proposal. U.S. and Iranian officials separately spoke with mediators on Sep.28. Araqchi then said Qatar had discussed ideas for how Iran's conditions might be fulfilled and would take those ideas to Washington. Trump separately denied reports that he had offered sanctions relief or frozen-fund release. These records establish active bargaining through mediators but not U.S. acceptance of Iran's conditions, sanctions relief, asset release, or a replacement settlement.",
        "knowledge_time": "2026-09-29T16:28:31-04:00",
        "source_ids": [
          "SRC-F998CB101972",
          "SRC-147F3EB0E6BC",
          "SRC-25BB1B596B72",
          "SRC-6D4B41984CFD",
          "SRC-3C3CB8B494AA",
          "SRC-B63B1CFF1B21",
          "SRC-F98CA0A64F09",
          "SRC-BE3466904600",
          "SRC-E48C2BF4BA86",
          "SRC-5EB57BE7099F",
          "SRC-49ED905D994D",
          "SRC-18A822A93DFC",
          "SRC-C7A82D89ACEA",
          "SRC-F917DE0C3BC3",
          "SRC-A5BA6AAB7890",
          "SRC-0042073EBED2",
          "SRC-03EF3E9F6CD4",
          "SRC-5572ACB81217",
          "SRC-13A4316EB312",
          "SRC-B52CFBB65D5A"
        ]
      }
    }
  ],
  "narrative_claims": []
}
